<?xml version="1.0"?>
<!DOCTYPE message SYSTEM "schema/message.dtd">
<message>
	<data>
		<callback>123abc</callback>
		<signal>2</signal>
		<urgency>5</urgency>
		<body>Anestesi påbörjad <room-name/></body>
	</data>
	<filter timestamp="5">
		<role>Ansv ssk ane</role>
		<room>all</room>
		<max-delay>10</max-delay>
	</filter>
</message>
